,tweet_id,text,retweet_count,created_at
237,1648349865775099909,"    Sounds like Biden’s Regime. Big Government and Big tech, Globalist one world government bullshit.Oh and Warmongers U.S. troops in Ukraine now. Wake up",0,Tue Apr 18 15:36:47 +0000 2023
238,1648349862046433281, Are Hunter Biden and Donald Jr. buddies?,0,Tue Apr 18 15:36:46 +0000 2023
239,1648349858456289286,   Biden wins more votes than Obama but only half the counties. Just another anomaly that never occurs naturally.,0,Tue Apr 18 15:36:45 +0000 2023
240,1648349858028290050,"JUST ANNOUNCED: President Biden will sign the MOST comprehensive Executive Order EVER including 50+  directives to nearly every cabinet-level agency to expand access to affordable, high-quality care, &amp; provide support for care workers &amp; family caregivers. 
https://t.co/5ZRtDZKHNm",224,Tue Apr 18 15:36:45 +0000 2023
241,1648349857973956608,"MTG who needed a pardon 3 days into her job, has done nothing for her GA constituents. She spends her time in Congress protecting Trump &amp; trying to “get” Biden. She claims to have dirt on Biden but she doesn’t present it, instead asks for someone to come forward &amp; give her dirt. https://t.co/ZW9xeIbdAh",0,Tue Apr 18 15:36:45 +0000 2023
242,1648349855360897024,"   Except the media has no reason to attack the left for the actions of a trans or Biden voter or Bernie employee. This is why you only see the right being attacked, and the beauty of being in the middle is that I can see all idiocy and don’t have voluntary blinders on",0,Tue Apr 18 15:36:45 +0000 2023
243,1648349849035632644,  Anyone voting for Biden is very confused,0,Tue Apr 18 15:36:43 +0000 2023
244,1648349844984176640,"😮🤣🤣😂😂This dude is CERTIFIABLE!
'He told me he voted for me': Trump throws tantrum after Elon Musk admits backing Biden https://t.co/RkylhRaXDV",12,Tue Apr 18 15:36:42 +0000 2023
245,1648349844765802497,"Just Announced:
Dark Biden is working for the American people while the GQP works for the 1% super rich.",42,Tue Apr 18 15:36:42 +0000 2023
246,1648349843901784064, When exactly did you have time to read 2000 pages of ANYTHING when all you are doing is spouting off on Twitter and searching for any way you can to slap Biden around while running to New York to defend donnie? Your little one way mind couldn't handle it........,0,Tue Apr 18 15:36:42 +0000 2023
247,1648349843834785792,"Elon Musk 
Did you really vote for Joe Biden ?",0,Tue Apr 18 15:36:42 +0000 2023
248,1648349841234477062,Biden Investigation: Kentucky Rep. James Comer told NEWSMAX that his committee's revelatory investigation now pins nine members of the Biden family connected to influence peddling. https://t.co/hE4A9i2XkH https://t.co/Dz3VI70c6M,0,Tue Apr 18 15:36:41 +0000 2023
249,1648349839787446278,"Biden administration ignored warning signs, dodged blame for migrants forced into child labor: Report https://t.co/VQxpIF4rmD #FoxNews",0,Tue Apr 18 15:36:41 +0000 2023
250,1648349839078354947," Maybe that’s the point. I genuinely think there are some Republicans who are okay with essentially handing ‘24 to Biden because it gives them something to run against. “Biden is terrible, give me money”! 
I want a Republican nominee who can actually beat Biden. We need to win",0,Tue Apr 18 15:36:41 +0000 2023
251,1648349835706134528,"   I would like an admission of error that you voted for Biden.  All your accomplishments all your amazingness, and now I have to question your judgment, or mine? Seeing 's capabilities before and after the election, it was clear to me Trump was the better choice.",0,Tue Apr 18 15:36:40 +0000 2023
252,1648349831784718336," Honest US citizen here, I don’t get why many people hate Biden. I think he’s one of the best presidents  in the country right now. He needs time to do this. We should back him and trust the process. We can do this! Let’s go US!",0,Tue Apr 18 15:36:39 +0000 2023
253,1648349831662796802,Polls show Republicans can beat Biden in 2024 but not if they nominate Trump: https://t.co/UTo2Ye2bim,0,Tue Apr 18 15:36:39 +0000 2023
254,1648349829762826242,  If you can't accept the utter failure of Biden in that sh*tshow then you are just a sheep. The failure of the supreme military commander in guiding the army and  foreign policy months after his election is just incompetency and not the fault of the guy who is no longer in power.,0,Tue Apr 18 15:36:38 +0000 2023
255,1648349822821310464," Who are these people?? I literally know only one person IRL who approves of Biden, she’s I.",0,Tue Apr 18 15:36:37 +0000 2023
256,1648349822544670720, Biden has been a complete disaster in every area.,0,Tue Apr 18 15:36:37 +0000 2023
257,1648349822183698438,"Biden administration likes to watch dudes compete in women's sports. 

What a nightmare this administration is. 🤡show.",0,Tue Apr 18 15:36:37 +0000 2023
258,1648349822016012288,"In  just now I asked the ORR Director why 85,000 children from the border are missing once they're placed to sponsors through her agency.  

She had no answers.  

The Biden Administration has faux compassion for these kids. https://t.co/3hOfvZ78uP",828,Tue Apr 18 15:36:37 +0000 2023
259,1648349821525458944,"  Can you give me Biden's dates of service?

Oh, that's right, he was deferred five times just like Trump...",0,Tue Apr 18 15:36:36 +0000 2023
260,1648349816790061056,Biden is helping russia more and more - he is a criminal,0,Tue Apr 18 15:36:35 +0000 2023
261,1648349815972003842," I’ve only voted democrat my whole life, for a variety of reasons.  I still can’t get down with the far rights social agenda, but watching Gensler, Warren, Clinton, Biden etc exploit the lack of public knowledge surrounding digital assets has been a turning point.",0,Tue Apr 18 15:36:35 +0000 2023
262,1648349815305035777, Joe Biden is a criminal must be brought up on treason along with Hunter Biden Jill Biden Chuck Schumer Mitch McConnell Nancy pelosi Adam Schiff Maxine Waters,0,Tue Apr 18 15:36:35 +0000 2023
263,1648349814046748674,"I'm a Trump, Desantis, Youngkin, Scott Republican.  BUT......who else is just simply tired and exhausted of all the whining about all that Biden and family do and have done but nothing is ever...ever ...EVER done!!!",0,Tue Apr 18 15:36:35 +0000 2023
264,1648349814000848897, When will you pay your fair share? When will Hunter and the rest of the Biden family pay their fair share?,0,Tue Apr 18 15:36:35 +0000 2023
265,1648349813765709830,"  133 million is false, 159 million is more accurate.  But I agree , they reached full capacity  with 81 million for basement  Biden.",0,Tue Apr 18 15:36:35 +0000 2023
266,1648349812935237634,"  To think even his own family won't endorse him. His family and Joe Biden have been friends for decades. 
I don't know where this Kennedy went off the rails, but he took a bad turn some place.",1,Tue Apr 18 15:36:34 +0000 2023
267,1648349811521859584," It seems to me that AF-1 has a door on the other side of the plane.  I may be wrong,  but I thought I'd seen it somewhere.  I'll try to see if I can find it.  I don't doubt for a minute they'd fake this, though.  The whole Biden Administration is fake.",1,Tue Apr 18 15:36:34 +0000 2023
268,1648349809244524544," Open Season on Former Presidents now,
So let's hear from OBAMA Under Oath on his Knowledge of the Biden's Family involvement?",0,Tue Apr 18 15:36:34 +0000 2023
269,1648349808225304577," Change the name from ""Biden Family"" to ""Trump Family"" and the same ppl saying it was in the up and up would he clamoring for the Trump Family arrest.",0,Tue Apr 18 15:36:33 +0000 2023
270,1648349802915319810,Critics Slam Biden For Being Dishonest About Afghanistan https://t.co/e6qAS3JFTM,1,Tue Apr 18 15:36:32 +0000 2023
271,1648349799077355520," Let me guess, John F, Left this part out. Double it, inflation, and being that over 5 million illegals walked on in since Joe Biden took office. 
https://t.co/ALLy0cOiBb… https://t.co/CtDUNIEFch",0,Tue Apr 18 15:36:31 +0000 2023
272,1648349794362859521,  When did you become so conservative? When the democrats duped you to vote for joe Biden you got mad and bought Twitter you could care less about free speech!  will never come back to Twitter 👍,0,Tue Apr 18 15:36:30 +0000 2023
273,1648349790860632065, That’s one small round of applause for Joe Biden vs. one thousand giant crowds cheering for Trump. #wow,0,Tue Apr 18 15:36:29 +0000 2023
274,1648349789480681474," The Biden Administration is the direct result of EQUITY!
  Being competent has nothing to do with EQUITY!!!",0,Tue Apr 18 15:36:29 +0000 2023
